<?xml version='1.0' encoding='UTF-8'?>
<!DOCTYPE list SYSTEM "DropListData.dtd">
<list>
  <npc id="35702">
    <droplist>
      <category chance="33.3333">
        <item chance="100.0000" id="9581" max="1" min="1" />
      </category>
    </droplist>
  </npc>
  <npc id="35711">
    <droplist>
      <category chance="25.7962">
        <item chance="100.0000" id="10014" max="1" min="1" />
      </category>
    </droplist>
  </npc>
  <npc id="35734">
    <droplist>
      <category chance="53.3333">
        <item chance="100.0000" id="36309" max="145" min="102" />
      </category>
    </droplist>
  </npc>
  <npc id="35766">
    <droplist>
      <category chance="52.3809">
        <item chance="100.0000" id="36309" max="144" min="107" />
      </category>
    </droplist>
  </npc>
  <npc id="35780">
    <droplist>
      <category chance="21.0027">
        <item chance="100.0000" id="10014" max="1" min="1" />
      </category>
    </droplist>
  </npc>
</list>
